{
  "kangxi_number": 27,
  "primary": {
    "char": "厂",
    "codepoint": "U+5382"
  },
  "radical_block": {
    "char": "⼚",
    "codepoint": "U+2F1A"
  },
  "variants": [
    {
      "char": "廠",
      "codepoint": "U+5EE0",
      "role": "orthographic",
      "script": "traditional",
      "source_identifier": "kTraditionalVariant"
    }
  ],
  "stroke_count": 2,
  "stroke_count_standard": "TW-CNS11643",
  "stroke_count_variants": [],
  "names": {
    "en": [
      "cliff"
    ],
    "ja": [
      "がんだれ"
    ]
  },
  "readings": {
    "pinyin": [
      {
        "reading": "hǎn",
        "context": "primary",
        "region": "TW",
        "standard": "TW-CNS11643"
      }
    ],
    "pinyin_variants": [
      {
        "reading": "chǎng",
        "region": "CN",
        "classification": "regional_attestation",
        "source_properties": [
          "kTGHZ2013",
          "kMandarin",
          "kHanyuPinyin"
        ]
      },
      {
        "reading": "yán",
        "region": "und",
        "classification": "dictionary_attestation",
        "source_properties": [
          "kHanyuPinyin"
        ]
      },
      {
        "reading": "ān",
        "region": "und",
        "classification": "dictionary_attestation",
        "source_properties": [
          "kHanyuPinyin"
        ]
      }
    ],
    "zhuyin": [
      "ㄏㄢˇ"
    ],
    "jyutping": [
      "cong2"
    ],
    "japanese_on": [
      "KAN"
    ],
    "japanese_kun": [
      "GAKE"
    ],
    "korean": [
      "EM",
      "HAN"
    ],
    "fanqie": [
      {
        "text": "呼旱"
      },
      {
        "text": "呼旰"
      }
    ]
  },
  "sources": {
    "kangxi_number": [
      "unicode-cjk-radicals-17.0.0"
    ],
    "primary": [
      "unicode-cjk-radicals-17.0.0"
    ],
    "radical_block": [
      "unicode-cjk-radicals-17.0.0"
    ],
    "variants": [
      "unicode-unihan-17.0.0"
    ],
    "stroke_count": [
      "cns11643-attributes-2026-08-05",
      "unicode-unihan-17.0.0"
    ],
    "stroke_count_standard": [
      "cns11643-attributes-2026-08-05",
      "unicode-unihan-17.0.0"
    ],
    "names.en": [
      "kanji-alive-radicals-master-audit"
    ],
    "names.ja": [
      "kanji-alive-radicals-master-audit"
    ],
    "readings.pinyin": [
      "cns11643-attributes-2026-08-05",
      "unicode-unihan-17.0.0"
    ],
    "readings.pinyin_variants": [
      "unicode-unihan-17.0.0"
    ],
    "readings.zhuyin": [
      "cns11643-attributes-2026-08-05",
      "unicode-unihan-17.0.0"
    ],
    "readings.jyutping": [
      "unicode-unihan-17.0.0"
    ],
    "readings.japanese_on": [
      "unicode-unihan-17.0.0"
    ],
    "readings.japanese_kun": [
      "unicode-unihan-17.0.0"
    ],
    "readings.korean": [
      "unicode-unihan-17.0.0"
    ],
    "readings.fanqie": [
      "unicode-unihan-17.0.0"
    ],
    "stroke_count_variants": [
      "makemeahanzi-graphics-master-audit",
      "unicode-unihan-17.0.0",
      "kanji-alive-radicals-master-audit"
    ],
    "definitions": [
      "unicode-unihan-17.0.0"
    ],
    "character_count_in_kangxi": [
      "enwiki-kangxi-radicals-2026-08-10"
    ],
    "character_count_in_kangxi_status": [
      "enwiki-kangxi-radicals-2026-08-10"
    ],
    "shuowen": [
      "zhwikisource-shuowen-2026-08-10"
    ],
    "shuowen.seal_glyph": [
      "commons-shuowen-540-svg-series-2026-08-10"
    ],
    "historical_forms.shuowen_seal_說文解字": [
      "commons-shuowen-540-svg-series-2026-08-10"
    ],
    "historical_forms.oracle_bone_甲骨文": [
      "commons-ancient-chinese-historical-form-files-2026-08-10"
    ],
    "historical_forms.bronze_金文": [
      "academia-sinica-xiaoxuetang-historical-glyphs-2026-08-10",
      "commons-ancient-chinese-historical-form-files-2026-08-10"
    ],
    "historical_forms.liushutong_六書通": [
      "commons-ancient-chinese-historical-form-files-2026-08-10",
      "codh-henrui-liushutong-te00008-21-series-2026-08-11"
    ],
    "english_definition": [
      "unicode-unihan-17.0.0"
    ],
    "stroke_order.svg_asset_id": [
      "makemeahanzi-graphics-master-audit"
    ],
    "stroke_order.standard": [
      "prc-stroke-order-gf0023-2020"
    ],
    "stroke_order.source_convention": [
      "makemeahanzi-graphics-master-audit"
    ],
    "stroke_order.formal_conformance": [
      "makemeahanzi-graphics-master-audit",
      "prc-stroke-order-gf0023-2020"
    ],
    "stroke_order.stroke_count": [
      "makemeahanzi-graphics-master-audit"
    ],
    "stroke_order.taiwan_cns_stroke_sequence": [
      "cns11643-attributes-2026-08-05"
    ]
  },
  "gaps": [
    {
      "field": "character_count_in_kangxi.primary_scan_verification",
      "reason": "source_unavailable",
      "detail": "The count is pinned secondary-source evidence; a single internally complete 1716 Kangxi scan has not yet been selected and counted."
    },
    {
      "field": "names.ko",
      "reason": "source_unavailable",
      "detail": "No approved Phase 1 source supplies a systematic Korean learner-style radical name."
    },
    {
      "field": "names.zh",
      "reason": "source_unavailable",
      "detail": "No approved Phase 1 source supplies a systematic Traditional-Chinese colloquial radical name."
    },
    {
      "field": "readings.hangul",
      "reason": "not_attested",
      "detail": "Unihan 17.0.0 has no kHangul value for the primary ideograph."
    },
    {
      "field": "semantic_field",
      "reason": "source_unavailable",
      "detail": "No approved Phase 2 source provides a systematic semantic-field taxonomy for all 214 radicals."
    },
    {
      "field": "stroke_order.stroke_types",
      "reason": "source_unavailable",
      "detail": "Make Me a Hanzi supplies ordered paths but no authoritative per-path stroke-type names; Taiwan CNS types are retained separately and are not assigned to PRC path indices."
    },
    {
      "field": "stroke_order.formal_standard_verification",
      "reason": "source_unavailable",
      "detail": "The GF 0023-2020 publication is reference-only and the path source claims PRC convention without formal per-character conformance evidence."
    }
  ],
  "conflicts": [],
  "definitions": [
    {
      "gloss": "factory, workshop; radical 27",
      "lang": "en",
      "register": "modern"
    }
  ],
  "semantic_field": null,
  "historical_forms": {
    "oracle_bone_甲骨文": [
      {
        "asset_id": "oracle-U+5382-commons-index",
        "path": "assets/oracle/U+5382/oracle-U+5382-commons-index.svg",
        "source_id": "commons-ancient-chinese-historical-form-files-2026-08-10",
        "source_file": "厂-oracle.svg",
        "license_id": "pd"
      }
    ],
    "bronze_金文": [
      {
        "asset_id": "sinica-bronze-U+5382-representative",
        "path": "assets/bronze/U+5382/sinica-bronze-U+5382-representative.png",
        "source_id": "academia-sinica-xiaoxuetang-historical-glyphs-2026-08-10",
        "source_file": "33.E78D",
        "license_id": "CC0-1.0"
      },
      {
        "asset_id": "bronze-U+5382-commons-index",
        "path": "assets/bronze/U+5382/bronze-U+5382-commons-index.svg",
        "source_id": "commons-ancient-chinese-historical-form-files-2026-08-10",
        "source_file": "厂-bronze.svg",
        "license_id": "pd"
      }
    ],
    "shuowen_seal_說文解字": [
      {
        "asset_id": "shuowen-540-U+5382",
        "path": "assets/shuowen_seal/U+5382/shuowen-540-U+5382.svg",
        "source_id": "commons-shuowen-540-svg-series-2026-08-10",
        "source_file": "Shuowen Seal Radical 298.svg",
        "license_id": "cc-by-sa-3.0"
      }
    ],
    "liushutong_六書通": [
      {
        "asset_id": "liushutong-U+5382-commons-index",
        "path": "assets/liushutong/U+5382/liushutong-U+5382-commons-index.svg",
        "source_id": "commons-ancient-chinese-historical-form-files-2026-08-10",
        "source_file": "厂-bigseal.svg",
        "license_id": "pd"
      },
      {
        "asset_id": "codh-liushutong-TE00008-U+5382-001",
        "path": "assets/liushutong/U+5382/codh-liushutong-TE00008-U+5382-001.jpg",
        "source_id": "codh-henrui-liushutong-te00008-21-series-2026-08-11",
        "source_file": "U+5382_TE00008_0029_1_X1321_Y0944.jpg",
        "license_id": "CC-BY-SA-4.0"
      },
      {
        "asset_id": "codh-liushutong-TE00015-U+5382-001",
        "path": "assets/liushutong/U+5382/codh-liushutong-TE00015-U+5382-001.jpg",
        "source_id": "codh-henrui-liushutong-te00008-21-series-2026-08-11",
        "source_file": "U+5382_TE00015_0029_1_X1321_Y0944.jpg",
        "license_id": "CC-BY-SA-4.0"
      },
      {
        "asset_id": "codh-liushutong-TE00008-U+5382-002",
        "path": "assets/liushutong/U+5382/codh-liushutong-TE00008-U+5382-002.jpg",
        "source_id": "codh-henrui-liushutong-te00008-21-series-2026-08-11",
        "source_file": "U+5382_TE00008_0029_1_X1332_Y1227.jpg",
        "license_id": "CC-BY-SA-4.0"
      },
      {
        "asset_id": "codh-liushutong-TE00015-U+5382-002",
        "path": "assets/liushutong/U+5382/codh-liushutong-TE00015-U+5382-002.jpg",
        "source_id": "codh-henrui-liushutong-te00008-21-series-2026-08-11",
        "source_file": "U+5382_TE00015_0029_1_X1332_Y1227.jpg",
        "license_id": "CC-BY-SA-4.0"
      }
    ]
  },
  "character_count_in_kangxi": 129,
  "character_count_in_kangxi_status": "secondary_source_unverified",
  "shuowen": {
    "radical_number": 298,
    "source_headword": "厂",
    "mapping_type": "exact_heading",
    "entry_text": "山石之厓巖，人可居。象形。凡厂之屬皆从厂。",
    "edition_notes": null,
    "source_page": "說文解字/09",
    "page_id": 99567,
    "revision_id": 2025949,
    "revision_timestamp": "2021-04-12T07:11:14Z",
    "seal_glyph": {
      "asset_id": "shuowen-540-U+5382",
      "path": "assets/shuowen_seal/U+5382/shuowen-540-U+5382.svg",
      "source_id": "commons-shuowen-540-svg-series-2026-08-10",
      "source_file": "Shuowen Seal Radical 298.svg",
      "license_id": "cc-by-sa-3.0"
    }
  },